"Spanish";"Danish";"Icelandic";"Estonian";"Finnish";"Norwegian";"Czech";"Romanian";"Albanian";"English";"French";"German";"Portuguese";"Polish";"Latvian";"Dutch";"Lithuanian";"Swedish";"Italian";"Croatian"
"Y a toda bestia de la tierra, y a todas las aves de los cielos, y a todo lo que se mueve sobre la tierra, en que hay ánima viviente, toda verdura de hierba verde les será para comer; y fue así.
";"men alle Jordens Dyr og alle Himmelens Fugle og alt, hvad der kryber paa Jorden, og som har Livsaande, giver jeg alle grønne Urter til Føde.« Og saaledes skete det.
";"Og öllum dýrum jarðarinnar, öllum fuglum himinsins, öllum skriðdýrum jarðarinnar, öllu sem hefur lífsanda í sér, gef ég öll grös og jurtir til fæðu.“ Og það varð svo.
";"Ja kõigile loomadele maa peal ja kõikidele lindudele taeva all ja kõigile roomajaile maa peal, kelles on elav hing, annan Ma kõiksugu haljast rohtu toiduks!” Ja nõnda sündis.
";"Ja kaikille metsäeläimille ja kaikille taivaan linnuille ja kaikille, jotka maassa matelevat ja joissa on elävä henki, minä annan kaikkinaiset viheriät ruohot ravinnoksi"". Ja tapahtui niin.
";"Og alle dyr på jorden og alle fugler under himmelen og alt som rører sig på jorden, alt som det er livsånde i, gir jeg alle grønne urter å ete. Og det blev så. 
";"Všechněm pak živočichům zemským, i všemu ptactvu nebeskému, a všemu tomu, což se hýbe na zemi, v čemž jest duše živá, všelikou bylinu zelenou dal jsem ku pokrmu. I stalo se tak.
";"Iar tuturor fiarelor pămîntului, tuturor păsărilor cerului, şi tuturor vietăţilor cari se mişcă pe pămînt, cari au în ele o suflare de viaţă, le-am dat ca hrană toată iarba verde. Şi aşa a fost.
";"Dhe çdo kafshe të tokës, çdo zogu të qiellit dhe çdo gjëje që lëviz mbi tokë dhe ka në vetvete një frymë jete, unë i jap çdo bar të gjelbër si ushqim"". Dhe kështu u bë.
";"And to every beast of the earth, and to every fowl of the air, and to every thing that creepeth upon the earth, wherein there is life, I have given every green herb for meat: and it was so.
";"Mais j'ai donné à toutes les bêtes de la terre, et à tous les oiseaux des cieux et à toute chose qui se meut sur la terre, ayant vie en soi-même, toute herbe verte pour manger; et il fut ainsi.
";"und allem Getier auf Erden und allen Vögeln unter dem Himmel und allem Gewürm, das da lebt auf Erden, daß sie allerlei grünes Kraut essen. Und es geschah also.
";"E a todos os animais da terra, a todas as aves do céu e a todo ser vivente que se arrasta sobre a terra, tenho dado todas as ervas verdes como mantimento. E assim foi.
";"I wszelkiemu zwierzowi ziemskiemu, i wszystkiemu ptactwu niebieskiemu, i wszelkiej rzeczy ruszającej się na ziemi, w której jest dusza żywiąca; wszelka jarzyna ziela będzie ku pokarmowi; i stało się tak.
";"Bet visiem zemes zvēriem un visiem putniem gaisā, un visiem rāpuļiem, kas rāpo pa zemes virsu, kam dzīvība, Es dodu visu zaļo zāli par barību."" Un tā tapa.
";"Maar aan al het gedierte der aarde, en aan al het gevogelte des hemels, en aan al het kruipende gedierte op de aarde, waarin een levende ziel is, heb Ik al het groene kruid tot spijze gegeven. En het was alzo.
";"Ir visiems žemės gyvūnams, visiems padangių paukščiams ir visiems, kas kruta ant žemės, kas turi gyvybę, daviau visus žaliuojančius augalus maistui”. Ir taip įvyko.
";"Men åt alla djur på jorden och åt alla fåglar under himmelen och åt allt som krälar på jorden, vad som i sig har en levande själ, åt dessa giver jag alla gröna örter till föda.» Och det skedde så.
";"E ad ogni animale della terra e ad ogni uccello dei cieli e a tutto ciò che si muove sulla terra ed ha in sé un soffio di vita, io do ogni erba verde per nutrimento"". E così fu.
";"A zvijerima na zemlji i pticama u zraku i gmizavcima sto puze po zemlji u kojima je dah zivota - neka je za hranu sve zeleno bilje!"" I bi tako.
"
"Y vio Dios todo lo que había hecho, y he aquí que era bueno en gran manera. Y fue la tarde y la mañana el día sexto.";"Og Gud saa alt, hvad han havde gjort, og se, det var saare godt. Og det blev Aften, og det blev Morgen, sjette Dag.";"Og Guð leit allt sem hann hafði gert, og sjá, það var harla gott. Og það varð kvöld og það varð morgunn, hinn sjötti dagur.";"Ja Jumal vaatas kõike, mis Ta oli teinud, ja vaata, see oli väga hea! Siis sai õhtu ja sai hommik, — kuues päev.";"Ja Jumala katsoi kaikkea, mitä hän tehnyt oli, ja katso, se oli sangen hyvää. Ja tuli ehtoo, ja tuli aamu, kuudes päivä.";"Og Gud så på alt det han hadde gjort, og se, det var såre godt. Og det blev aften, og det blev morgen, sjette dag.";"A viděl Bůh vše, což učinil, a aj, bylo velmi dobré. I byl večer a bylo jitro, den šestý.";"Dumnezeu S'a uitat la tot ce făcuse; şi iată că erau foarte bune. Astfel a fost o seară, şi apoi a fost o dimineaţă: aceasta a fost ziua a şasea.";"Atëherë Perëndia shikoi të gjitha ato që kishte bërë, dhe ja, ishte shumë mirë. Kështu erdhi mbrëmja dhe pastaj erdhi mëngjesi: dita e gjashtë.";"And God saw every thing that he had made, and, behold, it was very good. And the evening and the morning were the sixth day.";"Et Dieu vit tout ce qu'il avait fait, et voilà il était très-bon; ainsi fut le soir, ainsi fut le matin; ce fut le sixième jour.";"Und Gott sah alles an, was er gemacht hatte; und siehe da, es war sehr gut. Da ward aus Abend und Morgen der sechste Tag.";"E viu Deus tudo quanto fizera, e eis que era muito bom. E foi a tarde e a manhã, o dia sexto.";"I widział Bóg wszystko, co uczynił, a oto było bardzo dobre; i stał się wieczór, i stał się zaranek, dzień szósty.";"Un Dievs uzlūkoja visu, ko Viņš bija darījis, un redzi, tas bija ļoti labs. Un tapa vakars un tapa rīts - sestā diena.";"En God zag al wat Hij gemaakt had, en ziet, het was zeer goed. Toen was het avond geweest, en het was morgen geweest, de zesde dag.";"Dievas matė visa, ką buvo padaręs, ir tai buvo labai gerai. Buvo vakaras ir rytas­ šeštoji diena. ";"Och Gud såg på allt som han hade gjort, och se, det var mycket gott. Och det vart afton, och det vart morgon, den sjätte dagen.
";"E Dio vide tutto quello che aveva fatto, ed ecco, era molto buono. Così fu sera, poi fu mattina: e fu il sesto giorno.";"I vidje Bog sve sto je ucinio, i bijase veoma dobro. Tako bude vecer, pa jutro - dan sesti."
